{
  "meta": {
    "format_version": 1,
    "software": "obd-sim",
    "started_at": "2026-07-21T22:12:48.200240750Z",
    "ended_at": "2026-07-21T22:12:48.200298400Z",
    "vin": "1FTFW1E50MFA00000",
    "adapter_path": "replay://sample",
    "capabilities": {
      "elm_compatible": true,
      "stn": false,
      "ms_can": false,
      "link": "other",
      "identity": "ELM327 SAMPLE",
      "protocol": "ISO 15765-4 (CAN 11/500)"
    },
    "profile_id": "generic_j1979",
    "notes": "Synthetic fixture for CI and offline TUI."
  },
  "frames": [
    {
      "ts": "2026-07-21T22:12:48.200253590Z",
      "dir": "tx",
      "bus": "hs",
      "data": "ATI"
    },
    {
      "ts": "2026-07-21T22:12:48.200254552Z",
      "dir": "rx",
      "bus": "hs",
      "data": "ELM327 SAMPLE"
    },
    {
      "ts": "2026-07-21T22:12:48.200254881Z",
      "dir": "tx",
      "bus": "hs",
      "data": "ATDP"
    },
    {
      "ts": "2026-07-21T22:12:48.200255041Z",
      "dir": "rx",
      "bus": "hs",
      "data": "ISO 15765-4 (CAN 11/500)"
    },
    {
      "ts": "2026-07-21T22:12:48.200255189Z",
      "dir": "tx",
      "bus": "hs",
      "data": "0902"
    },
    {
      "ts": "2026-07-21T22:12:48.200255534Z",
      "dir": "rx",
      "bus": "hs",
      "data": "4902013146544657314535304D46413030303030"
    },
    {
      "ts": "2026-07-21T22:12:48.200255717Z",
      "dir": "tx",
      "bus": "hs",
      "data": "0100"
    },
    {
      "ts": "2026-07-21T22:12:48.200255857Z",
      "dir": "rx",
      "bus": "hs",
      "data": "4100BE3EA813"
    },
    {
      "ts": "2026-07-21T22:12:48.200256013Z",
      "dir": "tx",
      "bus": "hs",
      "data": "010C"
    },
    {
      "ts": "2026-07-21T22:12:48.200256225Z",
      "dir": "rx",
      "bus": "hs",
      "data": "410C1AF8"
    },
    {
      "ts": "2026-07-21T22:12:48.200256342Z",
      "dir": "tx",
      "bus": "hs",
      "data": "010D"
    },
    {
      "ts": "2026-07-21T22:12:48.200256548Z",
      "dir": "rx",
      "bus": "hs",
      "data": "410D00"
    },
    {
      "ts": "2026-07-21T22:12:48.200256675Z",
      "dir": "tx",
      "bus": "hs",
      "data": "0105"
    },
    {
      "ts": "2026-07-21T22:12:48.200256791Z",
      "dir": "rx",
      "bus": "hs",
      "data": "41056A"
    },
    {
      "ts": "2026-07-21T22:12:48.200256908Z",
      "dir": "tx",
      "bus": "hs",
      "data": "0111"
    },
    {
      "ts": "2026-07-21T22:12:48.200257023Z",
      "dir": "rx",
      "bus": "hs",
      "data": "411180"
    },
    {
      "ts": "2026-07-21T22:12:48.200257140Z",
      "dir": "tx",
      "bus": "hs",
      "data": "0104"
    },
    {
      "ts": "2026-07-21T22:12:48.200257286Z",
      "dir": "rx",
      "bus": "hs",
      "data": "410440"
    },
    {
      "ts": "2026-07-21T22:12:48.200257417Z",
      "dir": "tx",
      "bus": "hs",
      "data": "03"
    },
    {
      "ts": "2026-07-21T22:12:48.200257554Z",
      "dir": "rx",
      "bus": "hs",
      "data": "430301"
    },
    {
      "ts": "2026-07-21T22:12:48.200257673Z",
      "dir": "tx",
      "bus": "hs",
      "data": "07"
    },
    {
      "ts": "2026-07-21T22:12:48.200257787Z",
      "dir": "rx",
      "bus": "hs",
      "data": "470000"
    },
    {
      "ts": "2026-07-21T22:12:48.200257904Z",
      "dir": "tx",
      "bus": "hs",
      "data": "010C"
    },
    {
      "ts": "2026-07-21T22:12:48.200258023Z",
      "dir": "rx",
      "bus": "hs",
      "data": "410C1B00"
    },
    {
      "ts": "2026-07-21T22:12:48.200258237Z",
      "dir": "tx",
      "bus": "hs",
      "data": "010D"
    },
    {
      "ts": "2026-07-21T22:12:48.200258353Z",
      "dir": "rx",
      "bus": "hs",
      "data": "410D20"
    },
    {
      "ts": "2026-07-21T22:12:48.200258472Z",
      "dir": "tx",
      "bus": "hs",
      "data": "0105"
    },
    {
      "ts": "2026-07-21T22:12:48.200258605Z",
      "dir": "rx",
      "bus": "hs",
      "data": "41056B"
    },
    {
      "ts": "2026-07-21T22:12:48.200258722Z",
      "dir": "tx",
      "bus": "hs",
      "data": "0111"
    },
    {
      "ts": "2026-07-21T22:12:48.200258834Z",
      "dir": "rx",
      "bus": "hs",
      "data": "411190"
    },
    {
      "ts": "2026-07-21T22:12:48.200258953Z",
      "dir": "tx",
      "bus": "hs",
      "data": "0104"
    },
    {
      "ts": "2026-07-21T22:12:48.200259067Z",
      "dir": "rx",
      "bus": "hs",
      "data": "410450"
    },
    {
      "ts": "2026-07-21T22:12:48.200259185Z",
      "dir": "tx",
      "bus": "hs",
      "data": "010C"
    },
    {
      "ts": "2026-07-21T22:12:48.200260347Z",
      "dir": "rx",
      "bus": "hs",
      "data": "410C1C00"
    },
    {
      "ts": "2026-07-21T22:12:48.200260495Z",
      "dir": "tx",
      "bus": "hs",
      "data": "010D"
    },
    {
      "ts": "2026-07-21T22:12:48.200260666Z",
      "dir": "rx",
      "bus": "hs",
      "data": "410D30"
    },
    {
      "ts": "2026-07-21T22:12:48.200260782Z",
      "dir": "tx",
      "bus": "hs",
      "data": "0105"
    },
    {
      "ts": "2026-07-21T22:12:48.200260989Z",
      "dir": "rx",
      "bus": "hs",
      "data": "41056C"
    },
    {
      "ts": "2026-07-21T22:12:48.200261131Z",
      "dir": "tx",
      "bus": "hs",
      "data": "0111"
    },
    {
      "ts": "2026-07-21T22:12:48.200261248Z",
      "dir": "rx",
      "bus": "hs",
      "data": "4111A0"
    },
    {
      "ts": "2026-07-21T22:12:48.200261368Z",
      "dir": "tx",
      "bus": "hs",
      "data": "0104"
    },
    {
      "ts": "2026-07-21T22:12:48.200261521Z",
      "dir": "rx",
      "bus": "hs",
      "data": "410460"
    }
  ],
  "signals": [
    {
      "ts": "2026-07-21T22:12:48.200288002Z",
      "name": "engine_rpm",
      "value": 1726.0,
      "unit": "rpm",
      "mode": 1,
      "pid": 12,
      "bus": "hs"
    }
  ],
  "vehicle_yaml": "id: generic_j1979\nname: Generic J1979\nmakes: [\"*\"]\nnotes: Sample fixture profile.\ndual_bus: false\npids: []\nmodules: []\n"
}