{
  "meta": {
    "format_version": 1,
    "software": "obdtui-live-capture",
    "started_at": "2026-07-21T22:32:12.863129Z",
    "ended_at": "2026-07-21T22:32:12.863129Z",
    "vin": "1FTEW1EP9KFC73499",
    "adapter_path": "bt://00:04:3E:96:B8:F1",
    "capabilities": {
      "elm_compatible": true,
      "stn": true,
      "ms_can": true,
      "link": "bluetooth_spp",
      "identity": "ELM327 v1.4b",
      "protocol": "AUTO"
    },
    "profile_id": "ford_stub",
    "notes": "Live Ford truck (F-150 class) via OBDLink MX+ 41832 Bluetooth SPP. First successful session 2026-07-21."
  },
  "frames": [
    {
      "ts": "2026-07-21T22:32:12.863129Z",
      "dir": "tx",
      "bus": "hs",
      "data": "ATZ"
    },
    {
      "ts": "2026-07-21T22:32:12.863129Z",
      "dir": "rx",
      "bus": "hs",
      "data": "ELM327 v1.4b"
    },
    {
      "ts": "2026-07-21T22:32:12.863129Z",
      "dir": "tx",
      "bus": "hs",
      "data": "ATE0"
    },
    {
      "ts": "2026-07-21T22:32:12.863129Z",
      "dir": "rx",
      "bus": "hs",
      "data": "OK"
    },
    {
      "ts": "2026-07-21T22:32:12.863129Z",
      "dir": "tx",
      "bus": "hs",
      "data": "ATL0"
    },
    {
      "ts": "2026-07-21T22:32:12.863129Z",
      "dir": "rx",
      "bus": "hs",
      "data": "OK"
    },
    {
      "ts": "2026-07-21T22:32:12.863129Z",
      "dir": "tx",
      "bus": "hs",
      "data": "ATS0"
    },
    {
      "ts": "2026-07-21T22:32:12.863129Z",
      "dir": "rx",
      "bus": "hs",
      "data": "OK"
    },
    {
      "ts": "2026-07-21T22:32:12.863129Z",
      "dir": "tx",
      "bus": "hs",
      "data": "ATH0"
    },
    {
      "ts": "2026-07-21T22:32:12.863129Z",
      "dir": "rx",
      "bus": "hs",
      "data": "OK"
    },
    {
      "ts": "2026-07-21T22:32:12.863129Z",
      "dir": "tx",
      "bus": "hs",
      "data": "ATSP0"
    },
    {
      "ts": "2026-07-21T22:32:12.863129Z",
      "dir": "rx",
      "bus": "hs",
      "data": "OK"
    },
    {
      "ts": "2026-07-21T22:32:12.863129Z",
      "dir": "tx",
      "bus": "hs",
      "data": "ATI"
    },
    {
      "ts": "2026-07-21T22:32:12.863129Z",
      "dir": "rx",
      "bus": "hs",
      "data": "ELM327 v1.4b"
    },
    {
      "ts": "2026-07-21T22:32:12.863129Z",
      "dir": "tx",
      "bus": "hs",
      "data": "ATDP"
    },
    {
      "ts": "2026-07-21T22:32:12.863129Z",
      "dir": "rx",
      "bus": "hs",
      "data": "AUTO"
    },
    {
      "ts": "2026-07-21T22:32:12.863129Z",
      "dir": "tx",
      "bus": "hs",
      "data": "0100"
    },
    {
      "ts": "2026-07-21T22:32:12.863129Z",
      "dir": "rx",
      "bus": "hs",
      "data": "41 00 BE 3E A8 13"
    },
    {
      "ts": "2026-07-21T22:32:12.863129Z",
      "dir": "tx",
      "bus": "hs",
      "data": "0902"
    },
    {
      "ts": "2026-07-21T22:32:12.863129Z",
      "dir": "rx",
      "bus": "hs",
      "data": "0: 49 02 01 31 46 54\n1: 45 57 31 45 50 39 4B\n2: 46 43 37 33 34 39 39"
    },
    {
      "ts": "2026-07-21T22:32:12.863129Z",
      "dir": "tx",
      "bus": "hs",
      "data": "010C"
    },
    {
      "ts": "2026-07-21T22:32:12.863129Z",
      "dir": "rx",
      "bus": "hs",
      "data": "41 0C 0A 1C"
    },
    {
      "ts": "2026-07-21T22:32:12.863129Z",
      "dir": "tx",
      "bus": "hs",
      "data": "010D"
    },
    {
      "ts": "2026-07-21T22:32:12.863129Z",
      "dir": "rx",
      "bus": "hs",
      "data": "41 0D 00"
    },
    {
      "ts": "2026-07-21T22:32:12.863129Z",
      "dir": "tx",
      "bus": "hs",
      "data": "0105"
    },
    {
      "ts": "2026-07-21T22:32:12.863129Z",
      "dir": "rx",
      "bus": "hs",
      "data": "41 05 6A"
    },
    {
      "ts": "2026-07-21T22:32:12.863129Z",
      "dir": "tx",
      "bus": "hs",
      "data": "0111"
    },
    {
      "ts": "2026-07-21T22:32:12.863129Z",
      "dir": "rx",
      "bus": "hs",
      "data": "41 11 00"
    },
    {
      "ts": "2026-07-21T22:32:12.863129Z",
      "dir": "tx",
      "bus": "hs",
      "data": "0104"
    },
    {
      "ts": "2026-07-21T22:32:12.863129Z",
      "dir": "rx",
      "bus": "hs",
      "data": "41 04 00"
    },
    {
      "ts": "2026-07-21T22:32:12.863129Z",
      "dir": "tx",
      "bus": "hs",
      "data": "010C"
    },
    {
      "ts": "2026-07-21T22:32:12.863129Z",
      "dir": "rx",
      "bus": "hs",
      "data": "41 0C 0A 20"
    },
    {
      "ts": "2026-07-21T22:32:12.863129Z",
      "dir": "tx",
      "bus": "hs",
      "data": "010C"
    },
    {
      "ts": "2026-07-21T22:32:12.863129Z",
      "dir": "rx",
      "bus": "hs",
      "data": "41 0C 0A 18"
    },
    {
      "ts": "2026-07-21T22:32:12.863129Z",
      "dir": "tx",
      "bus": "hs",
      "data": "03"
    },
    {
      "ts": "2026-07-21T22:32:12.863129Z",
      "dir": "rx",
      "bus": "hs",
      "data": "43 00"
    },
    {
      "ts": "2026-07-21T22:32:12.863129Z",
      "dir": "tx",
      "bus": "hs",
      "data": "07"
    },
    {
      "ts": "2026-07-21T22:32:12.863129Z",
      "dir": "rx",
      "bus": "hs",
      "data": "47 00"
    }
  ],
  "signals": [
    {
      "ts": "2026-07-21T22:32:12.863129Z",
      "name": "engine_rpm",
      "value": 647.0,
      "unit": "rpm",
      "mode": 1,
      "pid": 12,
      "bus": "hs"
    }
  ],
  "vehicle_yaml": null
}